{
  "schemaVersion": 1,
  "id": "classic.buttons.visual",
  "profileId": "m3-classic.compose-material3-1.4.0",
  "componentModelId": "classic.buttons",
  "status": "contract-only",
  "rendererSuiteIds": [
    "classic.buttons.text.renderer",
    "classic.buttons.filled.renderer",
    "classic.buttons.filled-tonal.renderer",
    "classic.buttons.outlined.renderer",
    "classic.buttons.elevated.renderer"
  ],
  "fixture": {
    "size": "small",
    "density": "default",
    "content": "label-only",
    "label": "Action"
  },
  "environment": {
    "seedColor": "#6750A4",
    "contrastMode": "standard",
    "colorBackend": "force-fallback",
    "applicationStyle": "Fusion",
    "locale": "C",
    "timeZone": "UTC",
    "layoutDirection": "left-to-right",
    "qpaPlatform": "offscreen",
    "devicePixelRatio": 1.0,
    "logicalDpiX": 96.0,
    "logicalDpiY": 96.0,
    "animation": {
      "driver": "direct-test-controller",
      "wallClockAllowed": false,
      "eventLoopWaitAllowed": false
    },
    "runtimeFingerprint": {
      "required": true,
      "algorithm": "sha256",
      "fields": [
        "runner-image",
        "operating-system",
        "operating-system-version",
        "architecture",
        "qt-version",
        "qt-build-abi",
        "compiler",
        "qpa-platform",
        "application-style",
        "font-family",
        "font-face-sha256",
        "font-style",
        "font-weight",
        "font-point-size",
        "device-pixel-ratio",
        "logical-dpi-x",
        "logical-dpi-y"
      ]
    }
  },
  "imageNormalization": {
    "logicalCanvas": {
      "width": 160,
      "height": 80
    },
    "widgetRect": {
      "x": 24,
      "y": 20,
      "width": 112,
      "height": 40
    },
    "backgroundColorRole": "Surface",
    "encoder": "png",
    "pixelFormat": "RGBA8888",
    "alphaMode": "straight",
    "colorSpace": "sRGB",
    "origin": "top-left",
    "metadataPolicy": "strip-all"
  },
  "comparisonPolicy": {
    "acceptance": "all-metrics",
    "pixel": {
      "maxDifferentPixels": 0,
      "maxChannelDelta": 0
    },
    "ssim": {
      "minimum": 1.0,
      "windowSize": 8,
      "channelModel": "rgba-independent",
      "windowTraversal": "non-overlapping",
      "edgePolicy": "require-exact-tiles",
      "covariance": "population",
      "dynamicRange": 255,
      "k1": 0.01,
      "k2": 0.03
    },
    "missingReference": "fail",
    "unexpectedReference": "fail",
    "dimensionMismatch": "fail",
    "environmentMismatch": "fail",
    "masksAllowed": false,
    "runtimeToleranceOverridesAllowed": false,
    "inTestReferenceUpdatesAllowed": false,
    "crossTargetReferenceSubstitutionAllowed": false
  },
  "captureRunner": {
    "status": "source-implemented",
    "executable": "qtmaterial3_material_button_capture",
    "mode": "actual-only",
    "manifestPath": "manifest.json",
    "actualPathTemplate": "actual/{componentId}/{state}/{theme}.png",
    "requiresEmptyOutputDirectory": true,
    "referenceWritesAllowed": false,
    "runtimeValidation": "fail-closed"
  },
  "comparisonRunner": {
    "status": "source-implemented",
    "executable": "tools/compare_material_visual_capture.py",
    "mode": "compare-only",
    "referenceManifestPath": "manifest.json",
    "reportPath": "comparison-report.json",
    "failureArtifactPathTemplate": "failures/{componentId}/{state}/{theme}/{kind}.{extension}",
    "requiresEmptyArtifactDirectory": true,
    "referenceWritesAllowed": false,
    "runtimeOverridesAllowed": false
  },
  "targets": [
    {
      "id": "windows-2022.qt5.14.2.msvc-v142",
      "operatingSystem": "windows",
      "runnerImage": "windows-2022",
      "architecture": "x86_64",
      "qtVersion": "5.14.2",
      "qtMajor": 5,
      "compiler": "msvc-19.29-v142",
      "font": {
        "family": "Segoe UI",
        "pointSize": 14,
        "exactMatchRequired": true,
        "faceFingerprintRequired": true,
        "substitutionsAllowed": false,
        "hintingPreference": "prefer-no-hinting"
      },
      "referenceRoot": "tests/visual/material3-references/classic/buttons/windows-2022.qt5.14.2.msvc-v142"
    },
    {
      "id": "windows-2022.qt6.7.3.msvc-v142",
      "operatingSystem": "windows",
      "runnerImage": "windows-2022",
      "architecture": "x86_64",
      "qtVersion": "6.7.3",
      "qtMajor": 6,
      "compiler": "msvc-19.29-v142",
      "font": {
        "family": "Segoe UI",
        "pointSize": 14,
        "exactMatchRequired": true,
        "faceFingerprintRequired": true,
        "substitutionsAllowed": false,
        "hintingPreference": "prefer-no-hinting"
      },
      "referenceRoot": "tests/visual/material3-references/classic/buttons/windows-2022.qt6.7.3.msvc-v142"
    },
    {
      "id": "ubuntu-24.04.qt6.8.4.gcc-13",
      "operatingSystem": "linux",
      "runnerImage": "ubuntu-24.04",
      "architecture": "x86_64",
      "qtVersion": "6.8.4",
      "qtMajor": 6,
      "compiler": "gcc-13",
      "font": {
        "family": "DejaVu Sans",
        "pointSize": 14,
        "exactMatchRequired": true,
        "faceFingerprintRequired": true,
        "substitutionsAllowed": false,
        "hintingPreference": "prefer-no-hinting"
      },
      "referenceRoot": "tests/visual/material3-references/classic/buttons/ubuntu-24.04.qt6.8.4.gcc-13"
    },
    {
      "id": "macos-15.qt6.8.4.apple-clang-16",
      "operatingSystem": "macos",
      "runnerImage": "macos-15",
      "architecture": "x86_64",
      "qtVersion": "6.8.4",
      "qtMajor": 6,
      "compiler": "apple-clang-16",
      "font": {
        "family": "Helvetica",
        "pointSize": 14,
        "exactMatchRequired": true,
        "faceFingerprintRequired": true,
        "substitutionsAllowed": false,
        "hintingPreference": "prefer-no-hinting"
      },
      "referenceRoot": "tests/visual/material3-references/classic/buttons/macos-15.qt6.8.4.apple-clang-16"
    }
  ],
  "referenceSets": [
    {
      "targetId": "windows-2022.qt5.14.2.msvc-v142",
      "status": "pending",
      "manifestPath": "tests/visual/material3-references/classic/buttons/windows-2022.qt5.14.2.msvc-v142/manifest.json"
    },
    {
      "targetId": "windows-2022.qt6.7.3.msvc-v142",
      "status": "pending",
      "manifestPath": "tests/visual/material3-references/classic/buttons/windows-2022.qt6.7.3.msvc-v142/manifest.json"
    },
    {
      "targetId": "ubuntu-24.04.qt6.8.4.gcc-13",
      "status": "pending",
      "manifestPath": "tests/visual/material3-references/classic/buttons/ubuntu-24.04.qt6.8.4.gcc-13/manifest.json"
    },
    {
      "targetId": "macos-15.qt6.8.4.apple-clang-16",
      "status": "pending",
      "manifestPath": "tests/visual/material3-references/classic/buttons/macos-15.qt6.8.4.apple-clang-16/manifest.json"
    }
  ],
  "stateSetups": [
    {
      "id": "enabled",
      "enabled": true,
      "hovered": false,
      "focused": false,
      "pressed": false,
      "stateLayerProgress": 0.0,
      "feedback": {
        "kind": "none",
        "progress": 0.0,
        "origin": {
          "normalizedX": 0.5,
          "normalizedY": 0.5
        }
      }
    },
    {
      "id": "disabled",
      "enabled": false,
      "hovered": false,
      "focused": false,
      "pressed": false,
      "stateLayerProgress": 0.0,
      "feedback": {
        "kind": "none",
        "progress": 0.0,
        "origin": {
          "normalizedX": 0.5,
          "normalizedY": 0.5
        }
      }
    },
    {
      "id": "hovered",
      "enabled": true,
      "hovered": true,
      "focused": false,
      "pressed": false,
      "stateLayerProgress": 1.0,
      "feedback": {
        "kind": "state-layer",
        "progress": 1.0,
        "origin": {
          "normalizedX": 0.5,
          "normalizedY": 0.5
        }
      }
    },
    {
      "id": "focused",
      "enabled": true,
      "hovered": false,
      "focused": true,
      "pressed": false,
      "stateLayerProgress": 1.0,
      "feedback": {
        "kind": "state-layer",
        "progress": 1.0,
        "origin": {
          "normalizedX": 0.5,
          "normalizedY": 0.5
        }
      }
    },
    {
      "id": "pressed",
      "enabled": true,
      "hovered": false,
      "focused": false,
      "pressed": true,
      "stateLayerProgress": 0.0,
      "feedback": {
        "kind": "ripple",
        "progress": 0.5,
        "origin": {
          "normalizedX": 0.5,
          "normalizedY": 0.5
        }
      }
    }
  ],
  "caseDimensions": {
    "components": [
      "button.text",
      "button.filled",
      "button.filled-tonal",
      "button.outlined",
      "button.elevated"
    ],
    "states": [
      "enabled",
      "disabled",
      "hovered",
      "focused",
      "pressed"
    ],
    "themes": [
      "light",
      "dark"
    ],
    "targets": [
      "windows-2022.qt5.14.2.msvc-v142",
      "windows-2022.qt6.7.3.msvc-v142",
      "ubuntu-24.04.qt6.8.4.gcc-13",
      "macos-15.qt6.8.4.apple-clang-16"
    ]
  },
  "expectedActualCount": 50,
  "expectedReferenceCount": 200,
  "cases": [
    {
      "id": "classic.buttons.visual.button.text.enabled.light",
      "componentId": "button.text",
      "rendererSuiteId": "classic.buttons.text.renderer",
      "state": "enabled",
      "stateSetupId": "enabled",
      "theme": "light",
      "actualPath": "actual/button.text/enabled/light.png",
      "references": [
        {
          "targetId": "windows-2022.qt5.14.2.msvc-v142",
          "path": "tests/visual/material3-references/classic/buttons/windows-2022.qt5.14.2.msvc-v142/button.text/enabled/light.png"
        },
        {
          "targetId": "windows-2022.qt6.7.3.msvc-v142",
          "path": "tests/visual/material3-references/classic/buttons/windows-2022.qt6.7.3.msvc-v142/button.text/enabled/light.png"
        },
        {
          "targetId": "ubuntu-24.04.qt6.8.4.gcc-13",